{
 "kind": "host-recipes",
 "schema": 1,
 "serial": 1,
 "date": "2026-10-12",
 "packages": {
  "curl": {
   "apt": "curl",
   "dnf": "curl",
   "yum": "curl",
   "apk": "curl"
  },
  "caCertificates": {
   "apt": "ca-certificates",
   "apk": "ca-certificates"
  },
  "bash": {
   "apk": "bash"
  },
  "python3": {
   "apt": "python3",
   "dnf": "python3",
   "yum": "python3",
   "apk": "python3"
  },
  "awk": {
   "apt": "gawk",
   "dnf": "gawk",
   "yum": "gawk",
   "apk": "gawk"
  },
  "sha256sum": {
   "apt": "coreutils",
   "dnf": "coreutils",
   "yum": "coreutils",
   "apk": "coreutils"
  },
  "sftpServer": {
   "apt": "openssh-sftp-server",
   "dnf": "openssh-server",
   "yum": "openssh-server",
   "apk": "openssh-sftp-server"
  },
  "bubblewrap": {
   "apt": "bubblewrap",
   "dnf": "bubblewrap",
   "yum": "bubblewrap",
   "apk": "bubblewrap"
  },
  "procps": {
   "apt": "procps",
   "dnf": "procps-ng",
   "yum": "procps-ng",
   "apk": "procps-ng"
  },
  "sudo": {
   "apt": "sudo",
   "dnf": "sudo",
   "apk": "sudo",
   "unknown": "sudo"
  },
  "uidmap": {
   "apt": "uidmap",
   "dnf": "uidmap",
   "yum": "uidmap",
   "apk": "shadow-uidmap"
  },
  "slirp4netns": {
   "apt": "slirp4netns",
   "dnf": "slirp4netns",
   "yum": "slirp4netns",
   "apk": "slirp4netns"
  }
 },
 "intents": {
  "tmux.install": [
   {
    "families": [
     "apt"
    ],
    "run": "{{sudo}}apt-get update && {{sudo}}apt-get install -y tmux"
   },
   {
    "families": [
     "dnf"
    ],
    "run": "{{sudo}}dnf install -y tmux"
   },
   {
    "families": [
     "yum"
    ],
    "run": "{{sudo}}yum install -y tmux"
   },
   {
    "families": [
     "pacman"
    ],
    "run": "{{sudo}}pacman -S --noconfirm tmux"
   },
   {
    "families": [
     "apk"
    ],
    "run": "{{sudo}}apk add tmux"
   },
   {
    "families": [
     "zypper"
    ],
    "run": "{{sudo}}zypper install -y tmux"
   },
   {
    "families": [
     "macos"
    ],
    "run": "brew install tmux"
   }
  ],
  "packages.install": [
   {
    "families": [
     "apt"
    ],
    "run": "{{sudo}}apt-get update && {{sudo}}apt-get install -y {{packages}}"
   },
   {
    "families": [
     "dnf"
    ],
    "run": "{{sudo}}dnf install -y {{packages}}"
   },
   {
    "families": [
     "yum"
    ],
    "run": "{{sudo}}yum install -y {{packages}}"
   },
   {
    "families": [
     "apk"
    ],
    "run": "{{sudo}}apk add {{packages}}"
   }
  ],
  "developer-tools.install": [
   {
    "families": [
     "macos"
    ],
    "run": "xcode-select --install"
   }
  ],
  "engine.docker.install-package": [
   {
    "families": [
     "apt"
    ],
    "run": "{{sudo}}apt-get update && {{sudo}}apt-get install -y docker.io"
   }
  ],
  "engine.docker.install-script": [
   {
    "families": [
     "apt",
     "unknown"
    ],
    "run": "curl -fsSL https://get.docker.com | sh",
    "admin": true
   }
  ],
  "engine.docker.install-alpine": [
   {
    "families": [
     "apk"
    ],
    "run": "{{sudo}}apk add docker docker-cli-compose && {{sudo}}rc-update add docker default && {{sudo}}rc-service docker start && {{sudo}}addgroup {{user}} docker"
   }
  ],
  "engine.docker.join-group": [
   {
    "families": [
     "apt",
     "unknown"
    ],
    "run": "{{sudo}}usermod -aG docker {{user}}"
   }
  ],
  "engine.podman.install": [
   {
    "families": [
     "apt"
    ],
    "run": "{{sudo}}apt-get update && {{sudo}}apt-get install -y podman"
   },
   {
    "families": [
     "dnf"
    ],
    "run": "{{sudo}}dnf install -y podman"
   }
  ],
  "engine.docker-desktop.install": [
   {
    "families": [
     "macos"
    ],
    "run": "brew install --cask docker-desktop"
   }
  ],
  "engine.orbstack.install": [
   {
    "families": [
     "macos"
    ],
    "run": "brew install --cask orbstack"
   }
  ],
  "engine.docker.start-systemd": [
   {
    "families": [
     "any"
    ],
    "run": "{{sudo}}systemctl enable --now docker"
   }
  ],
  "engine.docker.start-openrc": [
   {
    "families": [
     "any"
    ],
    "run": "{{sudo}}rc-service docker start && {{sudo}}rc-update add docker default"
   }
  ],
  "engine.podman.start-systemd": [
   {
    "families": [
     "any"
    ],
    "run": "{{sudo}}systemctl enable --now podman.socket"
   }
  ],
  "engine.podman.start-systemd-user": [
   {
    "families": [
     "any"
    ],
    "run": "systemctl --user enable --now podman.socket"
   }
  ],
  "engine.podman.start-openrc": [
   {
    "families": [
     "any"
    ],
    "run": "{{sudo}}rc-service podman start && {{sudo}}rc-update add podman default"
   }
  ],
  "engine.containerd.start-systemd": [
   {
    "families": [
     "any"
    ],
    "run": "{{sudo}}systemctl enable --now containerd"
   }
  ],
  "engine.containerd.start-openrc": [
   {
    "families": [
     "any"
    ],
    "run": "{{sudo}}rc-service containerd start && {{sudo}}rc-update add containerd default"
   }
  ],
  "engine.apple.start": [
   {
    "families": [
     "any"
    ],
    "run": "container system start"
   }
  ],
  "engine.docker-desktop.open": [
   {
    "families": [
     "macos"
    ],
    "run": "open -a Docker"
   }
  ],
  "engine.orbstack.open": [
   {
    "families": [
     "macos"
    ],
    "run": "open -a OrbStack"
   }
  ],
  "engine.colima.start": [
   {
    "families": [
     "macos"
    ],
    "run": "colima start"
   }
  ],
  "engine.podman-machine.start": [
   {
    "families": [
     "macos"
    ],
    "run": "podman machine start"
   }
  ],
  "compose.install-package": [
   {
    "families": [
     "apt"
    ],
    "ids": [
     "ubuntu",
     "linuxmint",
     "pop"
    ],
    "run": "{{sudo}}apt-get update && {{sudo}}apt-get install -y docker-compose-v2"
   },
   {
    "families": [
     "dnf"
    ],
    "run": "{{sudo}}dnf install -y docker-compose"
   },
   {
    "families": [
     "apk"
    ],
    "run": "{{sudo}}apk add docker-cli-compose"
   },
   {
    "families": [
     "macos"
    ],
    "run": "brew install docker-compose"
   }
  ],
  "compose.install-docker-repo": [
   {
    "families": [
     "any"
    ],
    "run": "curl -fsSL https://get.docker.com | sh",
    "admin": true
   }
  ],
  "compose.install-binary-docker": [
   {
    "families": [
     "apt",
     "dnf",
     "unknown"
    ],
    "run": "{{sudo}}mkdir -p /usr/local/lib/docker/cli-plugins && {{sudo}}curl -fsSL \"https://github.com/docker/compose/releases/latest/download/docker-compose-linux-$(uname -m)\" -o /usr/local/lib/docker/cli-plugins/docker-compose && {{sudo}}chmod +x /usr/local/lib/docker/cli-plugins/docker-compose"
   }
  ],
  "compose.install-binary-podman": [
   {
    "families": [
     "apt",
     "dnf",
     "unknown"
    ],
    "run": "{{sudo}}curl -fsSL \"https://github.com/docker/compose/releases/latest/download/docker-compose-linux-$(uname -m)\" -o /usr/local/bin/docker-compose && {{sudo}}chmod +x /usr/local/bin/docker-compose"
   }
  ],
  "podman.socket-user": [
   {
    "families": [
     "any"
    ],
    "run": "{ systemctl --user is-active --quiet podman.socket || systemctl --user enable --now podman.socket; }"
   }
  ],
  "podman.socket-system": [
   {
    "families": [
     "any"
    ],
    "run": "{ systemctl is-active --quiet podman.socket || {{sudo}}systemctl enable --now podman.socket; }",
    "admin": true
   }
  ],
  "git.install": [
   {
    "families": [
     "apt"
    ],
    "run": "{{sudo}}apt-get update && {{sudo}}apt-get install -y git"
   },
   {
    "families": [
     "dnf"
    ],
    "run": "{{sudo}}dnf install -y git"
   },
   {
    "families": [
     "apk"
    ],
    "run": "{{sudo}}apk add git"
   },
   {
    "families": [
     "macos"
    ],
    "run": "xcode-select --install"
   },
   {
    "families": [
     "unknown"
    ],
    "run": "if command -v apt-get >/dev/null; then {{sudo}}apt-get update && {{sudo}}apt-get install -y git; elif command -v dnf >/dev/null; then {{sudo}}dnf install -y git; elif command -v yum >/dev/null; then {{sudo}}yum install -y git; elif command -v apk >/dev/null; then {{sudo}}apk add git; fi"
   }
  ],
  "ca-certificates.install": [
   {
    "families": [
     "apt"
    ],
    "run": "{{sudo}}apt-get update && {{sudo}}apt-get install -y ca-certificates"
   },
   {
    "families": [
     "dnf"
    ],
    "run": "{{sudo}}dnf install -y ca-certificates"
   },
   {
    "families": [
     "apk"
    ],
    "run": "{{sudo}}apk add ca-certificates"
   },
   {
    "families": [
     "unknown"
    ],
    "run": "if command -v apt-get >/dev/null; then {{sudo}}apt-get update && {{sudo}}apt-get install -y ca-certificates; elif command -v dnf >/dev/null; then {{sudo}}dnf install -y ca-certificates; elif command -v yum >/dev/null; then {{sudo}}yum install -y ca-certificates; elif command -v apk >/dev/null; then {{sudo}}apk add ca-certificates; fi"
   }
  ],
  "podman.rootless-prerequisites": [
   {
    "families": [
     "apt"
    ],
    "ids": [
     "ubuntu",
     "debian",
     "raspbian",
     "linuxmint",
     "pop"
    ],
    "run": "{{sudo}}apt install -y {{packages}} passt"
   },
   {
    "families": [
     "dnf"
    ],
    "ids": [
     "fedora",
     "rhel",
     "centos",
     "rocky",
     "almalinux"
    ],
    "run": "{{sudo}}dnf install -y {{packages}}"
   }
  ],
  "engine.docker.rootless-setup": [
   {
    "families": [
     "any"
    ],
    "run": "dockerd-rootless-setuptool.sh install"
   }
  ],
  "engine.docker.rootless-enable": [
   {
    "families": [
     "any"
    ],
    "run": "systemctl --user enable --now docker"
   }
  ],
  "engine.docker.rootless-start": [
   {
    "families": [
     "any"
    ],
    "run": "systemctl --user start docker"
   }
  ],
  "engine.rootless.linger": [
   {
    "families": [
     "any"
    ],
    "run": "{{sudo}}loginctl enable-linger {{user}}"
   }
  ],
  "engine.rootless.apparmor-userns": [
   {
    "families": [
     "any"
    ],